No.     Time           Source                Destination           Protocol Length Info
      1 0.000000000    192.168.0.10          195.249.209.144       TCP      68     42402 → 80 [ACK] Seq=1 Ack=1 Win=245 Len=0 TSval=235052411 TSecr=1940532597

Frame 1: 68 bytes on wire (544 bits), 68 bytes captured (544 bits) on interface 0
Linux cooked capture
Internet Protocol Version 4, Src: 192.168.0.10, Dst: 195.249.209.144
Transmission Control Protocol, Src Port: 42402, Dst Port: 80, Seq: 1, Ack: 1, Len: 0
    Source Port: 42402
    Destination Port: 80
    [Stream index: 0]
    [TCP Segment Len: 0]
    Sequence number: 1    (relative sequence number)
    [Next sequence number: 1    (relative sequence number)]
    Acknowledgment number: 1    (relative ack number)
    1000 .... = Header Length: 32 bytes (8)
    Flags: 0x010 (ACK)
    Window size value: 245
    [Calculated window size: 245]
    [Window size scaling factor: -1 (unknown)]
    Checksum: 0x5663 [unverified]
    [Checksum Status: Unverified]
    Urgent pointer: 0
    Options: (12 bytes), No-Operation (NOP), No-Operation (NOP), Timestamps
    [Timestamps]

No.     Time           Source                Destination           Protocol Length Info
      2 0.013269903    195.249.209.144       192.168.0.10          TCP      68     [TCP ACKed unseen segment] 80 → 42402 [ACK] Seq=1 Ack=2 Win=243 Len=0 TSval=1940542650 TSecr=235052411

Frame 2: 68 bytes on wire (544 bits), 68 bytes captured (544 bits) on interface 0
Linux cooked capture
Internet Protocol Version 4, Src: 195.249.209.144, Dst: 192.168.0.10
Transmission Control Protocol, Src Port: 80, Dst Port: 42402, Seq: 1, Ack: 2, Len: 0
    Source Port: 80
    Destination Port: 42402
    [Stream index: 0]
    [TCP Segment Len: 0]
    Sequence number: 1    (relative sequence number)
    [Next sequence number: 1    (relative sequence number)]
    Acknowledgment number: 2    (relative ack number)
    1000 .... = Header Length: 32 bytes (8)
    Flags: 0x010 (ACK)
    Window size value: 243
    [Calculated window size: 243]
    [Window size scaling factor: -1 (unknown)]
    Checksum: 0x1736 [unverified]
    [Checksum Status: Unverified]
    Urgent pointer: 0
    Options: (12 bytes), No-Operation (NOP), No-Operation (NOP), Timestamps
    [SEQ/ACK analysis]
    [Timestamps]

No.     Time           Source                Destination           Protocol Length Info
      3 0.031920642    192.168.0.10          52.27.23.108          TCP      68     51340 → 443 [ACK] Seq=1 Ack=1 Win=327 Len=0 TSval=3135209360 TSecr=2020297285

Frame 3: 68 bytes on wire (544 bits), 68 bytes captured (544 bits) on interface 0
Linux cooked capture
Internet Protocol Version 4, Src: 192.168.0.10, Dst: 52.27.23.108
Transmission Control Protocol, Src Port: 51340, Dst Port: 443, Seq: 1, Ack: 1, Len: 0
    Source Port: 51340
    Destination Port: 443
    [Stream index: 1]
    [TCP Segment Len: 0]
    Sequence number: 1    (relative sequence number)
    [Next sequence number: 1    (relative sequence number)]
    Acknowledgment number: 1    (relative ack number)
    1000 .... = Header Length: 32 bytes (8)
    Flags: 0x010 (ACK)
    Window size value: 327
    [Calculated window size: 327]
    [Window size scaling factor: -1 (unknown)]
    Checksum: 0x0c60 [unverified]
    [Checksum Status: Unverified]
    Urgent pointer: 0
    Options: (12 bytes), No-Operation (NOP), No-Operation (NOP), Timestamps
    [Timestamps]

No.     Time           Source                Destination           Protocol Length Info
      4 0.031990448    192.168.0.10          52.27.23.108          TCP      68     51338 → 443 [ACK] Seq=1 Ack=1 Win=327 Len=0 TSval=3135209363 TSecr=2020297286

Frame 4: 68 bytes on wire (544 bits), 68 bytes captured (544 bits) on interface 0
Linux cooked capture
Internet Protocol Version 4, Src: 192.168.0.10, Dst: 52.27.23.108
Transmission Control Protocol, Src Port: 51338, Dst Port: 443, Seq: 1, Ack: 1, Len: 0
    Source Port: 51338
    Destination Port: 443
    [Stream index: 2]
    [TCP Segment Len: 0]
    Sequence number: 1    (relative sequence number)
    [Next sequence number: 1    (relative sequence number)]
    Acknowledgment number: 1    (relative ack number)
    1000 .... = Header Length: 32 bytes (8)
    Flags: 0x010 (ACK)
    Window size value: 327
    [Calculated window size: 327]
    [Window size scaling factor: -1 (unknown)]
    Checksum: 0x0c60 [unverified]
    [Checksum Status: Unverified]
    Urgent pointer: 0
    Options: (12 bytes), No-Operation (NOP), No-Operation (NOP), Timestamps
    [Timestamps]

No.     Time           Source                Destination           Protocol Length Info
      5 0.055440660    52.27.23.108          192.168.0.10          TCP      68     443 → 51344 [ACK] Seq=1 Ack=1 Win=125 Len=0 TSval=2020299794 TSecr=3135209196

Frame 5: 68 bytes on wire (544 bits), 68 bytes captured (544 bits) on interface 0
Linux cooked capture
Internet Protocol Version 4, Src: 52.27.23.108, Dst: 192.168.0.10
Transmission Control Protocol, Src Port: 443, Dst Port: 51344, Seq: 1, Ack: 1, Len: 0
    Source Port: 443
    Destination Port: 51344
    [Stream index: 3]
    [TCP Segment Len: 0]
    Sequence number: 1    (relative sequence number)
    [Next sequence number: 1    (relative sequence number)]
    Acknowledgment number: 1    (relative ack number)
    1000 .... = Header Length: 32 bytes (8)
    Flags: 0x010 (ACK)
    Window size value: 125
    [Calculated window size: 125]
    [Window size scaling factor: -1 (unknown)]
    Checksum: 0x4d1c [unverified]
    [Checksum Status: Unverified]
    Urgent pointer: 0
    Options: (12 bytes), No-Operation (NOP), No-Operation (NOP), Timestamps
    [Timestamps]

No.     Time           Source                Destination           Protocol Length Info
      6 0.056478793    52.27.23.108          192.168.0.10          TCP      68     443 → 51342 [ACK] Seq=1 Ack=1 Win=213 Len=0 TSval=2020299794 TSecr=3135209199

Frame 6: 68 bytes on wire (544 bits), 68 bytes captured (544 bits) on interface 0
Linux cooked capture
Internet Protocol Version 4, Src: 52.27.23.108, Dst: 192.168.0.10
Transmission Control Protocol, Src Port: 443, Dst Port: 51342, Seq: 1, Ack: 1, Len: 0
    Source Port: 443
    Destination Port: 51342
    [Stream index: 4]
    [TCP Segment Len: 0]
    Sequence number: 1    (relative sequence number)
    [Next sequence number: 1    (relative sequence number)]
    Acknowledgment number: 1    (relative ack number)
    1000 .... = Header Length: 32 bytes (8)
    Flags: 0x010 (ACK)
    Window size value: 213
    [Calculated window size: 213]
    [Window size scaling factor: -1 (unknown)]
    Checksum: 0x04f7 [unverified]
    [Checksum Status: Unverified]
    Urgent pointer: 0
    Options: (12 bytes), No-Operation (NOP), No-Operation (NOP), Timestamps
    [Timestamps]

No.     Time           Source                Destination           Protocol Length Info
      7 0.063833615    192.168.0.10          52.27.23.108          TCP      68     51346 → 443 [ACK] Seq=1 Ack=1 Win=327 Len=0 TSval=3135209385 TSecr=2020297291

Frame 7: 68 bytes on wire (544 bits), 68 bytes captured (544 bits) on interface 0
Linux cooked capture
Internet Protocol Version 4, Src: 192.168.0.10, Dst: 52.27.23.108
Transmission Control Protocol, Src Port: 51346, Dst Port: 443, Seq: 1, Ack: 1, Len: 0
    Source Port: 51346
    Destination Port: 443
    [Stream index: 5]
    [TCP Segment Len: 0]
    Sequence number: 1    (relative sequence number)
    [Next sequence number: 1    (relative sequence number)]
    Acknowledgment number: 1    (relative ack number)
    1000 .... = Header Length: 32 bytes (8)
    Flags: 0x010 (ACK)
    Window size value: 327
    [Calculated window size: 327]
    [Window size scaling factor: -1 (unknown)]
    Checksum: 0x0c60 [unverified]
    [Checksum Status: Unverified]
    Urgent pointer: 0
    Options: (12 bytes), No-Operation (NOP), No-Operation (NOP), Timestamps
    [Timestamps]

No.     Time           Source                Destination           Protocol Length Info
      8 0.063903912    192.168.0.10          52.27.23.108          TCP      68     51348 → 443 [ACK] Seq=1 Ack=1 Win=327 Len=0 TSval=3135209379 TSecr=2020297290

Frame 8: 68 bytes on wire (544 bits), 68 bytes captured (544 bits) on interface 0
Linux cooked capture
Internet Protocol Version 4, Src: 192.168.0.10, Dst: 52.27.23.108
Transmission Control Protocol, Src Port: 51348, Dst Port: 443, Seq: 1, Ack: 1, Len: 0
    Source Port: 51348
    Destination Port: 443
    [Stream index: 6]
    [TCP Segment Len: 0]
    Sequence number: 1    (relative sequence number)
    [Next sequence number: 1    (relative sequence number)]
    Acknowledgment number: 1    (relative ack number)
    1000 .... = Header Length: 32 bytes (8)
    Flags: 0x010 (ACK)
    Window size value: 327
    [Calculated window size: 327]
    [Window size scaling factor: -1 (unknown)]
    Checksum: 0x0c60 [unverified]
    [Checksum Status: Unverified]
    Urgent pointer: 0
    Options: (12 bytes), No-Operation (NOP), No-Operation (NOP), Timestamps
    [Timestamps]

No.     Time           Source                Destination           Protocol Length Info
      9 0.209405753    52.27.23.108          192.168.0.10          TCP      68     [TCP ACKed unseen segment] 443 → 51340 [ACK] Seq=1 Ack=2 Win=132 Len=0 TSval=2020299832 TSecr=3135209360

Frame 9: 68 bytes on wire (544 bits), 68 bytes captured (544 bits) on interface 0
Linux cooked capture
Internet Protocol Version 4, Src: 52.27.23.108, Dst: 192.168.0.10
Transmission Control Protocol, Src Port: 443, Dst Port: 51340, Seq: 1, Ack: 2, Len: 0
    Source Port: 443
    Destination Port: 51340
    [Stream index: 1]
    [TCP Segment Len: 0]
    Sequence number: 1    (relative sequence number)
    [Next sequence number: 1    (relative sequence number)]
    Acknowledgment number: 2    (relative ack number)
    1000 .... = Header Length: 32 bytes (8)
    Flags: 0x010 (ACK)
    Window size value: 132
    [Calculated window size: 132]
    [Window size scaling factor: -1 (unknown)]
    Checksum: 0xd258 [unverified]
    [Checksum Status: Unverified]
    Urgent pointer: 0
    Options: (12 bytes), No-Operation (NOP), No-Operation (NOP), Timestamps
    [SEQ/ACK analysis]
    [Timestamps]

No.     Time           Source                Destination           Protocol Length Info
     10 0.210961104    52.27.23.108          192.168.0.10          TCP      68     [TCP ACKed unseen segment] 443 → 51338 [ACK] Seq=1 Ack=2 Win=281 Len=0 TSval=2020299832 TSecr=3135209363

Frame 10: 68 bytes on wire (544 bits), 68 bytes captured (544 bits) on interface 0
Linux cooked capture
Internet Protocol Version 4, Src: 52.27.23.108, Dst: 192.168.0.10
Transmission Control Protocol, Src Port: 443, Dst Port: 51338, Seq: 1, Ack: 2, Len: 0
    Source Port: 443
    Destination Port: 51338
    [Stream index: 2]
    [TCP Segment Len: 0]
    Sequence number: 1    (relative sequence number)
    [Next sequence number: 1    (relative sequence number)]
    Acknowledgment number: 2    (relative ack number)
    1000 .... = Header Length: 32 bytes (8)
    Flags: 0x010 (ACK)
    Window size value: 281
    [Calculated window size: 281]
    [Window size scaling factor: -1 (unknown)]
    Checksum: 0x8543 [unverified]
    [Checksum Status: Unverified]
    Urgent pointer: 0
    Options: (12 bytes), No-Operation (NOP), No-Operation (NOP), Timestamps
    [SEQ/ACK analysis]
    [Timestamps]

No.     Time           Source                Destination           Protocol Length Info
     11 0.212568496    192.168.0.10          216.58.207.198        TLSv1.2  107    Application Data

Frame 11: 107 bytes on wire (856 bits), 107 bytes captured (856 bits) on interface 0
Linux cooked capture
Internet Protocol Version 4, Src: 192.168.0.10, Dst: 216.58.207.198
Transmission Control Protocol, Src Port: 54200, Dst Port: 443, Seq: 1, Ack: 1, Len: 39
    Source Port: 54200
    Destination Port: 443
    [Stream index: 7]
    [TCP Segment Len: 39]
    Sequence number: 1    (relative sequence number)
    [Next sequence number: 40    (relative sequence number)]
    Acknowledgment number: 1    (relative ack number)
    1000 .... = Header Length: 32 bytes (8)
    Flags: 0x018 (PSH, ACK)
    Window size value: 339
    [Calculated window size: 339]
    [Window size scaling factor: -1 (unknown)]
    Checksum: 0x6901 [unverified]
    [Checksum Status: Unverified]
    Urgent pointer: 0
    Options: (12 bytes), No-Operation (NOP), No-Operation (NOP), Timestamps
    [SEQ/ACK analysis]
    [Timestamps]
    TCP payload (39 bytes)
Secure Sockets Layer

No.     Time           Source                Destination           Protocol Length Info
     12 0.234772312    216.58.207.198        192.168.0.10          TLSv1.2  107    Application Data

Frame 12: 107 bytes on wire (856 bits), 107 bytes captured (856 bits) on interface 0
Linux cooked capture
Internet Protocol Version 4, Src: 216.58.207.198, Dst: 192.168.0.10
Transmission Control Protocol, Src Port: 443, Dst Port: 54200, Seq: 1, Ack: 40, Len: 39
    Source Port: 443
    Destination Port: 54200
    [Stream index: 7]
    [TCP Segment Len: 39]
    Sequence number: 1    (relative sequence number)
    [Next sequence number: 40    (relative sequence number)]
    Acknowledgment number: 40    (relative ack number)
    1000 .... = Header Length: 32 bytes (8)
    Flags: 0x018 (PSH, ACK)
    Window size value: 248
    [Calculated window size: 248]
    [Window size scaling factor: -1 (unknown)]
    Checksum: 0x646f [unverified]
    [Checksum Status: Unverified]
    Urgent pointer: 0
    Options: (12 bytes), No-Operation (NOP), No-Operation (NOP), Timestamps
    [SEQ/ACK analysis]
    [Timestamps]
    TCP payload (39 bytes)
Secure Sockets Layer

No.     Time           Source                Destination           Protocol Length Info
     13 0.245155609    52.27.23.108          192.168.0.10          TCP      68     [TCP ACKed unseen segment] 443 → 51346 [ACK] Seq=1 Ack=2 Win=288 Len=0 TSval=2020299841 TSecr=3135209385

Frame 13: 68 bytes on wire (544 bits), 68 bytes captured (544 bits) on interface 0
Linux cooked capture
Internet Protocol Version 4, Src: 52.27.23.108, Dst: 192.168.0.10
Transmission Control Protocol, Src Port: 443, Dst Port: 51346, Seq: 1, Ack: 2, Len: 0
    Source Port: 443
    Destination Port: 51346
    [Stream index: 5]
    [TCP Segment Len: 0]
    Sequence number: 1    (relative sequence number)
    [Next sequence number: 1    (relative sequence number)]
    Acknowledgment number: 2    (relative ack number)
    1000 .... = Header Length: 32 bytes (8)
    Flags: 0x010 (ACK)
    Window size value: 288
    [Calculated window size: 288]
    [Window size scaling factor: -1 (unknown)]
    Checksum: 0xcf0d [unverified]
    [Checksum Status: Unverified]
    Urgent pointer: 0
    Options: (12 bytes), No-Operation (NOP), No-Operation (NOP), Timestamps
    [SEQ/ACK analysis]
    [Timestamps]

No.     Time           Source                Destination           Protocol Length Info
     14 0.245172893    52.27.23.108          192.168.0.10          TCP      68     [TCP ACKed unseen segment] 443 → 51348 [ACK] Seq=1 Ack=2 Win=229 Len=0 TSval=2020299841 TSecr=3135209379

Frame 14: 68 bytes on wire (544 bits), 68 bytes captured (544 bits) on interface 0
Linux cooked capture
Internet Protocol Version 4, Src: 52.27.23.108, Dst: 192.168.0.10
Transmission Control Protocol, Src Port: 443, Dst Port: 51348, Seq: 1, Ack: 2, Len: 0
    Source Port: 443
    Destination Port: 51348
    [Stream index: 6]
    [TCP Segment Len: 0]
    Sequence number: 1    (relative sequence number)
    [Next sequence number: 1    (relative sequence number)]
    Acknowledgment number: 2    (relative ack number)
    1000 .... = Header Length: 32 bytes (8)
    Flags: 0x010 (ACK)
    Window size value: 229
    [Calculated window size: 229]
    [Window size scaling factor: -1 (unknown)]
    Checksum: 0x910f [unverified]
    [Checksum Status: Unverified]
    Urgent pointer: 0
    Options: (12 bytes), No-Operation (NOP), No-Operation (NOP), Timestamps
    [SEQ/ACK analysis]
    [Timestamps]

No.     Time           Source                Destination           Protocol Length Info
     15 0.276514114    192.168.0.10          216.58.207.198        TCP      68     54200 → 443 [ACK] Seq=40 Ack=40 Win=339 Len=0 TSval=758088407 TSecr=864547674

Frame 15: 68 bytes on wire (544 bits), 68 bytes captured (544 bits) on interface 0
Linux cooked capture
Internet Protocol Version 4, Src: 192.168.0.10, Dst: 216.58.207.198
Transmission Control Protocol, Src Port: 54200, Dst Port: 443, Seq: 40, Ack: 40, Len: 0
    Source Port: 54200
    Destination Port: 443
    [Stream index: 7]
    [TCP Segment Len: 0]
    Sequence number: 40    (relative sequence number)
    [Next sequence number: 40    (relative sequence number)]
    Acknowledgment number: 40    (relative ack number)
    1000 .... = Header Length: 32 bytes (8)
    Flags: 0x010 (ACK)
    Window size value: 339
    [Calculated window size: 339]
    [Window size scaling factor: -1 (unknown)]
    Checksum: 0x68da [unverified]
    [Checksum Status: Unverified]
    Urgent pointer: 0
    Options: (12 bytes), No-Operation (NOP), No-Operation (NOP), Timestamps
    [SEQ/ACK analysis]
    [Timestamps]

No.     Time           Source                Destination           Protocol Length Info
     16 0.511727384    192.168.0.10          81.95.241.179         TCP      68     45648 → 80 [ACK] Seq=1 Ack=1 Win=237 Len=0 TSval=4281102630 TSecr=1460868138

Frame 16: 68 bytes on wire (544 bits), 68 bytes captured (544 bits) on interface 0
Linux cooked capture
Internet Protocol Version 4, Src: 192.168.0.10, Dst: 81.95.241.179
Transmission Control Protocol, Src Port: 45648, Dst Port: 80, Seq: 1, Ack: 1, Len: 0
    Source Port: 45648
    Destination Port: 80
    [Stream index: 8]
    [TCP Segment Len: 0]
    Sequence number: 1    (relative sequence number)
    [Next sequence number: 1    (relative sequence number)]
    Acknowledgment number: 1    (relative ack number)
    1000 .... = Header Length: 32 bytes (8)
    Flags: 0x010 (ACK)
    Window size value: 237
    [Calculated window size: 237]
    [Window size scaling factor: -1 (unknown)]
    Checksum: 0x03ec [unverified]
    [Checksum Status: Unverified]
    Urgent pointer: 0
    Options: (12 bytes), No-Operation (NOP), No-Operation (NOP), Timestamps
    [Timestamps]

No.     Time           Source                Destination           Protocol Length Info
     17 0.528908572    81.95.241.179         192.168.0.10          TCP      68     [TCP ACKed unseen segment] 80 → 45648 [ACK] Seq=1 Ack=2 Win=235 Len=0 TSval=1460870705 TSecr=4281051628

Frame 17: 68 bytes on wire (544 bits), 68 bytes captured (544 bits) on interface 0
Linux cooked capture
Internet Protocol Version 4, Src: 81.95.241.179, Dst: 192.168.0.10
Transmission Control Protocol, Src Port: 80, Dst Port: 45648, Seq: 1, Ack: 2, Len: 0
    Source Port: 80
    Destination Port: 45648
    [Stream index: 8]
    [TCP Segment Len: 0]
    Sequence number: 1    (relative sequence number)
    [Next sequence number: 1    (relative sequence number)]
    Acknowledgment number: 2    (relative ack number)
    1000 .... = Header Length: 32 bytes (8)
    Flags: 0x010 (ACK)
    Window size value: 235
    [Calculated window size: 235]
    [Window size scaling factor: -1 (unknown)]
    Checksum: 0xd4a2 [unverified]
    [Checksum Status: Unverified]
    Urgent pointer: 0
    Options: (12 bytes), No-Operation (NOP), No-Operation (NOP), Timestamps
    [SEQ/ACK analysis]
    [Timestamps]

No.     Time           Source                Destination           Protocol Length Info
     18 1.002934409    192.168.0.4           224.0.0.251           MDNS     183    Standard query 0x0000 PTR _companion-link._tcp.local, "QU" question PTR _homekit._tcp.local, "QU" question PTR _airplay._tcp.local, "QU" question PTR _raop._tcp.local, "QU" question PTR _sleep-proxy._udp.local, "QU" question OPT

Frame 18: 183 bytes on wire (1464 bits), 183 bytes captured (1464 bits) on interface 0
Linux cooked capture
Internet Protocol Version 4, Src: 192.168.0.4, Dst: 224.0.0.251
User Datagram Protocol, Src Port: 5353, Dst Port: 5353
Multicast Domain Name System (query)

No.     Time           Source                Destination           Protocol Length Info
     19 1.006899454    fe80::cad:782f:7f3e:eed ff02::fb              MDNS     203    Standard query 0x0000 PTR _companion-link._tcp.local, "QU" question PTR _homekit._tcp.local, "QU" question PTR _airplay._tcp.local, "QU" question PTR _raop._tcp.local, "QU" question PTR _sleep-proxy._udp.local, "QU" question OPT

Frame 19: 203 bytes on wire (1624 bits), 203 bytes captured (1624 bits) on interface 0
Linux cooked capture
Internet Protocol Version 6, Src: fe80::cad:782f:7f3e:eed, Dst: ff02::fb
User Datagram Protocol, Src Port: 5353, Dst Port: 5353
Multicast Domain Name System (query)

No.     Time           Source                Destination           Protocol Length Info
     20 1.031082889    54.186.163.246        192.168.0.10          TLSv1.2  99     Alert (Level: Warning, Description: Unknown CA)

Frame 20: 99 bytes on wire (792 bits), 99 bytes captured (792 bits) on interface 0
Linux cooked capture
Internet Protocol Version 4, Src: 54.186.163.246, Dst: 192.168.0.10
Transmission Control Protocol, Src Port: 443, Dst Port: 48892, Seq: 1, Ack: 1, Len: 31
    Source Port: 443
    Destination Port: 48892
    [Stream index: 9]
    [TCP Segment Len: 31]
    Sequence number: 1    (relative sequence number)
    [Next sequence number: 32    (relative sequence number)]
    Acknowledgment number: 1    (relative ack number)
    1000 .... = Header Length: 32 bytes (8)
    Flags: 0x018 (PSH, ACK)
    Window size value: 137
    [Calculated window size: 137]
    [Window size scaling factor: -1 (unknown)]
    Checksum: 0x6f74 [unverified]
    [Checksum Status: Unverified]
    Urgent pointer: 0
    Options: (12 bytes), No-Operation (NOP), No-Operation (NOP), Timestamps
    [SEQ/ACK analysis]
    [Timestamps]
    TCP payload (31 bytes)
Secure Sockets Layer

No.     Time           Source                Destination           Protocol Length Info
     21 1.031112956    192.168.0.10          54.186.163.246        TCP      68     48892 → 443 [ACK] Seq=1 Ack=32 Win=254 Len=0 TSval=1251112369 TSecr=242031995

Frame 21: 68 bytes on wire (544 bits), 68 bytes captured (544 bits) on interface 0
Linux cooked capture
Internet Protocol Version 4, Src: 192.168.0.10, Dst: 54.186.163.246
Transmission Control Protocol, Src Port: 48892, Dst Port: 443, Seq: 1, Ack: 32, Len: 0
    Source Port: 48892
    Destination Port: 443
    [Stream index: 9]
    [TCP Segment Len: 0]
    Sequence number: 1    (relative sequence number)
    [Next sequence number: 1    (relative sequence number)]
    Acknowledgment number: 32    (relative ack number)
    1000 .... = Header Length: 32 bytes (8)
    Flags: 0x010 (ACK)
    Window size value: 254
    [Calculated window size: 254]
    [Window size scaling factor: -1 (unknown)]
    Checksum: 0x9b89 [unverified]
    [Checksum Status: Unverified]
    Urgent pointer: 0
    Options: (12 bytes), No-Operation (NOP), No-Operation (NOP), Timestamps
    [SEQ/ACK analysis]
    [Timestamps]

No.     Time           Source                Destination           Protocol Length Info
     22 1.031529966    192.168.0.10          54.186.163.246        TLSv1.2  99     Encrypted Alert

Frame 22: 99 bytes on wire (792 bits), 99 bytes captured (792 bits) on interface 0
Linux cooked capture
Internet Protocol Version 4, Src: 192.168.0.10, Dst: 54.186.163.246
Transmission Control Protocol, Src Port: 48892, Dst Port: 443, Seq: 1, Ack: 32, Len: 31
    Source Port: 48892
    Destination Port: 443
    [Stream index: 9]
    [TCP Segment Len: 31]
    Sequence number: 1    (relative sequence number)
    [Next sequence number: 32    (relative sequence number)]
    Acknowledgment number: 32    (relative ack number)
    1000 .... = Header Length: 32 bytes (8)
    Flags: 0x018 (PSH, ACK)
    Window size value: 254
    [Calculated window size: 254]
    [Window size scaling factor: -1 (unknown)]
    Checksum: 0x9ba8 [unverified]
    [Checksum Status: Unverified]
    Urgent pointer: 0
    Options: (12 bytes), No-Operation (NOP), No-Operation (NOP), Timestamps
    [SEQ/ACK analysis]
    [Timestamps]
    TCP payload (31 bytes)
Secure Sockets Layer

No.     Time           Source                Destination           Protocol Length Info
     23 1.031672957    192.168.0.10          54.186.163.246        TCP      68     48892 → 443 [FIN, ACK] Seq=32 Ack=32 Win=254 Len=0 TSval=1251112369 TSecr=242031995

Frame 23: 68 bytes on wire (544 bits), 68 bytes captured (544 bits) on interface 0
Linux cooked capture
Internet Protocol Version 4, Src: 192.168.0.10, Dst: 54.186.163.246
Transmission Control Protocol, Src Port: 48892, Dst Port: 443, Seq: 32, Ack: 32, Len: 0
    Source Port: 48892
    Destination Port: 443
    [Stream index: 9]
    [TCP Segment Len: 0]
    Sequence number: 32    (relative sequence number)
    [Next sequence number: 32    (relative sequence number)]
    Acknowledgment number: 32    (relative ack number)
    1000 .... = Header Length: 32 bytes (8)
    Flags: 0x011 (FIN, ACK)
    Window size value: 254
    [Calculated window size: 254]
    [Window size scaling factor: -1 (unknown)]
    Checksum: 0x9b89 [unverified]
    [Checksum Status: Unverified]
    Urgent pointer: 0
    Options: (12 bytes), No-Operation (NOP), No-Operation (NOP), Timestamps
    [Timestamps]

No.     Time           Source                Destination           Protocol Length Info
     24 1.213922424    192.168.0.10          147.75.83.23          TLSv1.2  114    Application Data

Frame 24: 114 bytes on wire (912 bits), 114 bytes captured (912 bits) on interface 0
Linux cooked capture
Internet Protocol Version 4, Src: 192.168.0.10, Dst: 147.75.83.23
Transmission Control Protocol, Src Port: 44136, Dst Port: 443, Seq: 1, Ack: 1, Len: 46
    Source Port: 44136
    Destination Port: 443
    [Stream index: 10]
    [TCP Segment Len: 46]
    Sequence number: 1    (relative sequence number)
    [Next sequence number: 47    (relative sequence number)]
    Acknowledgment number: 1    (relative ack number)
    1000 .... = Header Length: 32 bytes (8)
    Flags: 0x018 (PSH, ACK)
    Window size value: 330
    [Calculated window size: 330]
    [Window size scaling factor: -1 (unknown)]
    Checksum: 0xa769 [unverified]
    [Checksum Status: Unverified]
    Urgent pointer: 0
    Options: (12 bytes), No-Operation (NOP), No-Operation (NOP), Timestamps
    [SEQ/ACK analysis]
    [Timestamps]
    TCP payload (46 bytes)
Secure Sockets Layer

No.     Time           Source                Destination           Protocol Length Info
     25 1.214351008    192.168.0.10          147.75.83.82          TLSv1.2  114    Application Data

Frame 25: 114 bytes on wire (912 bits), 114 bytes captured (912 bits) on interface 0
Linux cooked capture
Internet Protocol Version 4, Src: 192.168.0.10, Dst: 147.75.83.82
Transmission Control Protocol, Src Port: 37028, Dst Port: 443, Seq: 1, Ack: 1, Len: 46
    Source Port: 37028
    Destination Port: 443
    [Stream index: 11]
    [TCP Segment Len: 46]
    Sequence number: 1    (relative sequence number)
    [Next sequence number: 47    (relative sequence number)]
    Acknowledgment number: 1    (relative ack number)
    1000 .... = Header Length: 32 bytes (8)
    Flags: 0x018 (PSH, ACK)
    Window size value: 1444
    [Calculated window size: 1444]
    [Window size scaling factor: -1 (unknown)]
    Checksum: 0xa7a4 [unverified]
    [Checksum Status: Unverified]
    Urgent pointer: 0
    Options: (12 bytes), No-Operation (NOP), No-Operation (NOP), Timestamps
    [SEQ/ACK analysis]
    [Timestamps]
    TCP payload (46 bytes)
Secure Sockets Layer

No.     Time           Source                Destination           Protocol Length Info
     26 1.214694644    192.168.0.10          31.13.72.12           TLSv1.2  107    Application Data

Frame 26: 107 bytes on wire (856 bits), 107 bytes captured (856 bits) on interface 0
Linux cooked capture
Internet Protocol Version 4, Src: 192.168.0.10, Dst: 31.13.72.12
Transmission Control Protocol, Src Port: 57090, Dst Port: 443, Seq: 1, Ack: 1, Len: 39
    Source Port: 57090
    Destination Port: 443
    [Stream index: 12]
    [TCP Segment Len: 39]
    Sequence number: 1    (relative sequence number)
    [Next sequence number: 40    (relative sequence number)]
    Acknowledgment number: 1    (relative ack number)
    1000 .... = Header Length: 32 bytes (8)
    Flags: 0x018 (PSH, ACK)
    Window size value: 1444
    [Calculated window size: 1444]
    [Window size scaling factor: -1 (unknown)]
    Checksum: 0x2819 [unverified]
    [Checksum Status: Unverified]
    Urgent pointer: 0
    Options: (12 bytes), No-Operation (NOP), No-Operation (NOP), Timestamps
    [SEQ/ACK analysis]
    [Timestamps]
    TCP payload (39 bytes)
Secure Sockets Layer

No.     Time           Source                Destination           Protocol Length Info
     27 1.214848202    54.186.163.246        192.168.0.10          TCP      68     [TCP Previous segment not captured] 443 → 48892 [ACK] Seq=33 Ack=32 Win=137 Len=0 TSval=242032041 TSecr=1251112369

Frame 27: 68 bytes on wire (544 bits), 68 bytes captured (544 bits) on interface 0
Linux cooked capture
Internet Protocol Version 4, Src: 54.186.163.246, Dst: 192.168.0.10
Transmission Control Protocol, Src Port: 443, Dst Port: 48892, Seq: 33, Ack: 32, Len: 0
    Source Port: 443
    Destination Port: 48892
    [Stream index: 9]
    [TCP Segment Len: 0]
    Sequence number: 33    (relative sequence number)
    [Next sequence number: 33    (relative sequence number)]
    Acknowledgment number: 32    (relative ack number)
    1000 .... = Header Length: 32 bytes (8)
    Flags: 0x010 (ACK)
    Window size value: 137
    [Calculated window size: 137]
    [Window size scaling factor: -1 (unknown)]
    Checksum: 0xee26 [unverified]
    [Checksum Status: Unverified]
    Urgent pointer: 0
    Options: (12 bytes), No-Operation (NOP), No-Operation (NOP), Timestamps
    [SEQ/ACK analysis]
    [Timestamps]

No.     Time           Source                Destination           Protocol Length Info
     28 1.215021618    192.168.0.10          216.58.207.195        TLSv1.2  107    Application Data

Frame 28: 107 bytes on wire (856 bits), 107 bytes captured (856 bits) on interface 0
Linux cooked capture
Internet Protocol Version 4, Src: 192.168.0.10, Dst: 216.58.207.195
Transmission Control Protocol, Src Port: 55320, Dst Port: 443, Seq: 1, Ack: 1, Len: 39
    Source Port: 55320
    Destination Port: 443
    [Stream index: 13]
    [TCP Segment Len: 39]
    Sequence number: 1    (relative sequence number)
    [Next sequence number: 40    (relative sequence number)]
    Acknowledgment number: 1    (relative ack number)
    1000 .... = Header Length: 32 bytes (8)
    Flags: 0x018 (PSH, ACK)
    Window size value: 807
    [Calculated window size: 807]
    [Window size scaling factor: -1 (unknown)]
    Checksum: 0x68fe [unverified]
    [Checksum Status: Unverified]
    Urgent pointer: 0
    Options: (12 bytes), No-Operation (NOP), No-Operation (NOP), Timestamps
    [SEQ/ACK analysis]
    [Timestamps]
    TCP payload (39 bytes)
Secure Sockets Layer

No.     Time           Source                Destination           Protocol Length Info
     29 1.215214610    54.186.163.246        192.168.0.10          TCP      68     443 → 48892 [ACK] Seq=33 Ack=33 Win=137 Len=0 TSval=242032041 TSecr=1251112369

Frame 29: 68 bytes on wire (544 bits), 68 bytes captured (544 bits) on interface 0
Linux cooked capture
Internet Protocol Version 4, Src: 54.186.163.246, Dst: 192.168.0.10
Transmission Control Protocol, Src Port: 443, Dst Port: 48892, Seq: 33, Ack: 33, Len: 0
    Source Port: 443
    Destination Port: 48892
    [Stream index: 9]
    [TCP Segment Len: 0]
    Sequence number: 33    (relative sequence number)
    [Next sequence number: 33    (relative sequence number)]
    Acknowledgment number: 33    (relative ack number)
    1000 .... = Header Length: 32 bytes (8)
    Flags: 0x010 (ACK)
    Window size value: 137
    [Calculated window size: 137]
    [Window size scaling factor: -1 (unknown)]
    Checksum: 0xee25 [unverified]
    [Checksum Status: Unverified]
    Urgent pointer: 0
    Options: (12 bytes), No-Operation (NOP), No-Operation (NOP), Timestamps
    [SEQ/ACK analysis]
    [Timestamps]

No.     Time           Source                Destination           Protocol Length Info
     30 1.215249783    54.186.163.246        192.168.0.10          TCP      68     [TCP Out-Of-Order] 443 → 48892 [FIN, ACK] Seq=32 Ack=32 Win=137 Len=0 TSval=242032041 TSecr=1251112369

Frame 30: 68 bytes on wire (544 bits), 68 bytes captured (544 bits) on interface 0
Linux cooked capture
Internet Protocol Version 4, Src: 54.186.163.246, Dst: 192.168.0.10
Transmission Control Protocol, Src Port: 443, Dst Port: 48892, Seq: 32, Ack: 32, Len: 0
    Source Port: 443
    Destination Port: 48892
    [Stream index: 9]
    [TCP Segment Len: 0]
    Sequence number: 32    (relative sequence number)
    [Next sequence number: 32    (relative sequence number)]
    Acknowledgment number: 32    (relative ack number)
    1000 .... = Header Length: 32 bytes (8)
    Flags: 0x011 (FIN, ACK)
    Window size value: 137
    [Calculated window size: 137]
    [Window size scaling factor: -1 (unknown)]
    Checksum: 0xee26 [unverified]
    [Checksum Status: Unverified]
    Urgent pointer: 0
    Options: (12 bytes), No-Operation (NOP), No-Operation (NOP), Timestamps
    [SEQ/ACK analysis]
    [Timestamps]

No.     Time           Source                Destination           Protocol Length Info
     31 1.215271835    192.168.0.10          54.186.163.246        TCP      68     48892 → 443 [ACK] Seq=33 Ack=33 Win=254 Len=0 TSval=1251112553 TSecr=242032041

Frame 31: 68 bytes on wire (544 bits), 68 bytes captured (544 bits) on interface 0
Linux cooked capture
Internet Protocol Version 4, Src: 192.168.0.10, Dst: 54.186.163.246
Transmission Control Protocol, Src Port: 48892, Dst Port: 443, Seq: 33, Ack: 33, Len: 0
    Source Port: 48892
    Destination Port: 443
    [Stream index: 9]
    [TCP Segment Len: 0]
    Sequence number: 33    (relative sequence number)
    [Next sequence number: 33    (relative sequence number)]
    Acknowledgment number: 33    (relative ack number)
    1000 .... = Header Length: 32 bytes (8)
    Flags: 0x010 (ACK)
    Window size value: 254
    [Calculated window size: 254]
    [Window size scaling factor: -1 (unknown)]
    Checksum: 0xecf8 [unverified]
    [Checksum Status: Unverified]
    Urgent pointer: 0
    Options: (12 bytes), No-Operation (NOP), No-Operation (NOP), Timestamps
    [SEQ/ACK analysis]
    [Timestamps]

No.     Time           Source                Destination           Protocol Length Info
     32 1.215684464    192.168.0.10          173.194.222.155       TLSv1.2  107    Application Data

Frame 32: 107 bytes on wire (856 bits), 107 bytes captured (856 bits) on interface 0
Linux cooked capture
Internet Protocol Version 4, Src: 192.168.0.10, Dst: 173.194.222.155
Transmission Control Protocol, Src Port: 37356, Dst Port: 443, Seq: 1, Ack: 1, Len: 39
    Source Port: 37356
    Destination Port: 443
    [Stream index: 14]
    [TCP Segment Len: 39]
    Sequence number: 1    (relative sequence number)
    [Next sequence number: 40    (relative sequence number)]
    Acknowledgment number: 1    (relative ack number)
    1000 .... = Header Length: 32 bytes (8)
    Flags: 0x018 (PSH, ACK)
    Window size value: 380
    [Calculated window size: 380]
    [Window size scaling factor: -1 (unknown)]
    Checksum: 0x4d5e [unverified]
    [Checksum Status: Unverified]
    Urgent pointer: 0
    Options: (12 bytes), No-Operation (NOP), No-Operation (NOP), Timestamps
    [SEQ/ACK analysis]
    [Timestamps]
    TCP payload (39 bytes)
Secure Sockets Layer

No.     Time           Source                Destination           Protocol Length Info
     33 1.215924487    192.168.0.10          216.58.211.130        TLSv1.2  107    Application Data

Frame 33: 107 bytes on wire (856 bits), 107 bytes captured (856 bits) on interface 0
Linux cooked capture
Internet Protocol Version 4, Src: 192.168.0.10, Dst: 216.58.211.130
Transmission Control Protocol, Src Port: 56172, Dst Port: 443, Seq: 1, Ack: 1, Len: 39
    Source Port: 56172
    Destination Port: 443
    [Stream index: 15]
    [TCP Segment Len: 39]
    Sequence number: 1    (relative sequence number)
    [Next sequence number: 40    (relative sequence number)]
    Acknowledgment number: 1    (relative ack number)
    1000 .... = Header Length: 32 bytes (8)
    Flags: 0x018 (PSH, ACK)
    Window size value: 481
    [Calculated window size: 481]
    [Window size scaling factor: -1 (unknown)]
    Checksum: 0x6cbd [unverified]
    [Checksum Status: Unverified]
    Urgent pointer: 0
    Options: (12 bytes), No-Operation (NOP), No-Operation (NOP), Timestamps
    [SEQ/ACK analysis]
    [Timestamps]
    TCP payload (39 bytes)
Secure Sockets Layer

No.     Time           Source                Destination           Protocol Length Info
     34 1.216685215    192.168.0.10          195.249.145.116       TLSv1.2  114    Application Data

Frame 34: 114 bytes on wire (912 bits), 114 bytes captured (912 bits) on interface 0
Linux cooked capture
Internet Protocol Version 4, Src: 192.168.0.10, Dst: 195.249.145.116
Transmission Control Protocol, Src Port: 51418, Dst Port: 443, Seq: 1, Ack: 1, Len: 46
    Source Port: 51418
    Destination Port: 443
    [Stream index: 16]
    [TCP Segment Len: 46]
    Sequence number: 1    (relative sequence number)
    [Next sequence number: 47    (relative sequence number)]
    Acknowledgment number: 1    (relative ack number)
    1000 .... = Header Length: 32 bytes (8)
    Flags: 0x018 (PSH, ACK)
    Window size value: 1885
    [Calculated window size: 1885]
    [Window size scaling factor: -1 (unknown)]
    Checksum: 0x1675 [unverified]
    [Checksum Status: Unverified]
    Urgent pointer: 0
    Options: (12 bytes), No-Operation (NOP), No-Operation (NOP), Timestamps
    [SEQ/ACK analysis]
    [Timestamps]
    TCP payload (46 bytes)
Secure Sockets Layer

No.     Time           Source                Destination           Protocol Length Info
     35 1.225883305    195.249.145.116       192.168.0.10          TCP      68     443 → 51418 [ACK] Seq=1 Ack=47 Win=315 Len=0 TSval=501446491 TSecr=717848705

Frame 35: 68 bytes on wire (544 bits), 68 bytes captured (544 bits) on interface 0
Linux cooked capture
Internet Protocol Version 4, Src: 195.249.145.116, Dst: 192.168.0.10
Transmission Control Protocol, Src Port: 443, Dst Port: 51418, Seq: 1, Ack: 47, Len: 0
    Source Port: 443
    Destination Port: 51418
    [Stream index: 16]
    [TCP Segment Len: 0]
    Sequence number: 1    (relative sequence number)
    [Next sequence number: 1    (relative sequence number)]
    Acknowledgment number: 47    (relative ack number)
    1000 .... = Header Length: 32 bytes (8)
    Flags: 0x010 (ACK)
    Window size value: 315
    [Calculated window size: 315]
    [Window size scaling factor: -1 (unknown)]
    Checksum: 0x7bae [unverified]
    [Checksum Status: Unverified]
    Urgent pointer: 0
    Options: (12 bytes), No-Operation (NOP), No-Operation (NOP), Timestamps
    [SEQ/ACK analysis]
    [Timestamps]

No.     Time           Source                Destination           Protocol Length Info
     36 1.226039297    195.249.145.116       192.168.0.10          TLSv1.2  114    Application Data

Frame 36: 114 bytes on wire (912 bits), 114 bytes captured (912 bits) on interface 0
Linux cooked capture
Internet Protocol Version 4, Src: 195.249.145.116, Dst: 192.168.0.10
Transmission Control Protocol, Src Port: 443, Dst Port: 51418, Seq: 1, Ack: 47, Len: 46
    Source Port: 443
    Destination Port: 51418
    [Stream index: 16]
    [TCP Segment Len: 46]
