No.     Time           Source                Destination           Protocol Length Info
      1 0.000000000    Vmware_97:46:06       Broadcast             ARP      60     Who has 192.168.80.128? Tell 192.168.80.129

Frame 1: 60 bytes on wire (480 bits), 60 bytes captured (480 bits) on interface 0
Ethernet II, Src: Vmware_97:46:06 (00:0c:29:97:46:06), Dst: Broadcast (ff:ff:ff:ff:ff:ff)
Address Resolution Protocol (request)

No.     Time           Source                Destination           Protocol Length Info
      2 0.000011365    Vmware_fa:01:8a       Vmware_97:46:06       ARP      42     192.168.80.128 is at 00:0c:29:fa:01:8a

Frame 2: 42 bytes on wire (336 bits), 42 bytes captured (336 bits) on interface 0
Ethernet II, Src: Vmware_fa:01:8a (00:0c:29:fa:01:8a), Dst: Vmware_97:46:06 (00:0c:29:97:46:06)
Address Resolution Protocol (reply)

No.     Time           Source                Destination           Protocol Length Info
      3 0.043498089    192.168.80.129        192.168.80.2          DNS      87     Standard query 0x6335 PTR 128.80.168.192.in-addr.arpa

Frame 3: 87 bytes on wire (696 bits), 87 bytes captured (696 bits) on interface 0
Ethernet II, Src: Vmware_97:46:06 (00:0c:29:97:46:06), Dst: Vmware_f3:32:e6 (00:50:56:f3:32:e6)
Internet Protocol Version 4, Src: 192.168.80.129, Dst: 192.168.80.2
User Datagram Protocol, Src Port: 55736, Dst Port: 53
Domain Name System (query)

No.     Time           Source                Destination           Protocol Length Info
      4 0.054044172    192.168.80.2          192.168.80.129        DNS      139    Standard query response 0x6335 No such name PTR 128.80.168.192.in-addr.arpa SOA 168.192.in-addr.arpa

Frame 4: 139 bytes on wire (1112 bits), 139 bytes captured (1112 bits) on interface 0
Ethernet II, Src: Vmware_f3:32:e6 (00:50:56:f3:32:e6), Dst: Vmware_97:46:06 (00:0c:29:97:46:06)
Internet Protocol Version 4, Src: 192.168.80.2, Dst: 192.168.80.129
User Datagram Protocol, Src Port: 53, Dst Port: 55736
Domain Name System (response)

No.     Time           Source                Destination           Protocol Length Info
      5 0.096891323    192.168.80.129        192.168.80.128        TCP      60     45497 → 256 [SYN] Seq=0 Win=1024 Len=0 MSS=1460

Frame 5: 60 bytes on wire (480 bits), 60 bytes captured (480 bits) on interface 0
Ethernet II, Src: Vmware_97:46:06 (00:0c:29:97:46:06), Dst: Vmware_fa:01:8a (00:0c:29:fa:01:8a)
Internet Protocol Version 4, Src: 192.168.80.129, Dst: 192.168.80.128
Transmission Control Protocol, Src Port: 45497, Dst Port: 256, Seq: 0, Len: 0
    Source Port: 45497
    Destination Port: 256
    [Stream index: 0]
    [TCP Segment Len: 0]
    Sequence number: 0    (relative sequence number)
    [Next sequence number: 0    (relative sequence number)]
    Acknowledgment number: 0
    0110 .... = Header Length: 24 bytes (6)
    Flags: 0x002 (SYN)
    Window size value: 1024
    [Calculated window size: 1024]
    Checksum: 0x6217 [unverified]
    [Checksum Status: Unverified]
    Urgent pointer: 0
    Options: (4 bytes), Maximum segment size
    [Timestamps]

No.     Time           Source                Destination           Protocol Length Info
      6 0.096924997    192.168.80.128        192.168.80.129        TCP      54     256 → 45497 [RST, ACK] Seq=1 Ack=1 Win=0 Len=0

Frame 6: 54 bytes on wire (432 bits), 54 bytes captured (432 bits) on interface 0
Ethernet II, Src: Vmware_fa:01:8a (00:0c:29:fa:01:8a), Dst: Vmware_97:46:06 (00:0c:29:97:46:06)
Internet Protocol Version 4, Src: 192.168.80.128, Dst: 192.168.80.129
Transmission Control Protocol, Src Port: 256, Dst Port: 45497, Seq: 1, Ack: 1, Len: 0
    Source Port: 256
    Destination Port: 45497
    [Stream index: 0]
    [TCP Segment Len: 0]
    Sequence number: 1    (relative sequence number)
    [Next sequence number: 1    (relative sequence number)]
    Acknowledgment number: 1    (relative ack number)
    0101 .... = Header Length: 20 bytes (5)
    Flags: 0x014 (RST, ACK)
    Window size value: 0
    [Calculated window size: 0]
    [Window size scaling factor: -2 (no window scaling used)]
    Checksum: 0x7dc0 [unverified]
    [Checksum Status: Unverified]
    Urgent pointer: 0
    [SEQ/ACK analysis]
    [Timestamps]

No.     Time           Source                Destination           Protocol Length Info
      7 0.096991644    192.168.80.129        192.168.80.128        TCP      60     45497 → 445 [SYN] Seq=0 Win=1024 Len=0 MSS=1460

Frame 7: 60 bytes on wire (480 bits), 60 bytes captured (480 bits) on interface 0
Ethernet II, Src: Vmware_97:46:06 (00:0c:29:97:46:06), Dst: Vmware_fa:01:8a (00:0c:29:fa:01:8a)
Internet Protocol Version 4, Src: 192.168.80.129, Dst: 192.168.80.128
Transmission Control Protocol, Src Port: 45497, Dst Port: 445, Seq: 0, Len: 0
    Source Port: 45497
    Destination Port: 445
    [Stream index: 1]
    [TCP Segment Len: 0]
    Sequence number: 0    (relative sequence number)
    [Next sequence number: 0    (relative sequence number)]
    Acknowledgment number: 0
    0110 .... = Header Length: 24 bytes (6)
    Flags: 0x002 (SYN)
    Window size value: 1024
    [Calculated window size: 1024]
    Checksum: 0x615a [unverified]
    [Checksum Status: Unverified]
    Urgent pointer: 0
    Options: (4 bytes), Maximum segment size
    [Timestamps]

No.     Time           Source                Destination           Protocol Length Info
      8 0.097003053    192.168.80.128        192.168.80.129        TCP      54     445 → 45497 [RST, ACK] Seq=1 Ack=1 Win=0 Len=0

Frame 8: 54 bytes on wire (432 bits), 54 bytes captured (432 bits) on interface 0
Ethernet II, Src: Vmware_fa:01:8a (00:0c:29:fa:01:8a), Dst: Vmware_97:46:06 (00:0c:29:97:46:06)
Internet Protocol Version 4, Src: 192.168.80.128, Dst: 192.168.80.129
Transmission Control Protocol, Src Port: 445, Dst Port: 45497, Seq: 1, Ack: 1, Len: 0
    Source Port: 445
    Destination Port: 45497
    [Stream index: 1]
    [TCP Segment Len: 0]
    Sequence number: 1    (relative sequence number)
    [Next sequence number: 1    (relative sequence number)]
    Acknowledgment number: 1    (relative ack number)
    0101 .... = Header Length: 20 bytes (5)
    Flags: 0x014 (RST, ACK)
    Window size value: 0
    [Calculated window size: 0]
    [Window size scaling factor: -2 (no window scaling used)]
    Checksum: 0x7d03 [unverified]
    [Checksum Status: Unverified]
    Urgent pointer: 0
    [SEQ/ACK analysis]
    [Timestamps]

No.     Time           Source                Destination           Protocol Length Info
      9 0.097044752    192.168.80.129        192.168.80.128        TCP      60     45497 → 1025 [SYN] Seq=0 Win=1024 Len=0 MSS=1460

Frame 9: 60 bytes on wire (480 bits), 60 bytes captured (480 bits) on interface 0
Ethernet II, Src: Vmware_97:46:06 (00:0c:29:97:46:06), Dst: Vmware_fa:01:8a (00:0c:29:fa:01:8a)
Internet Protocol Version 4, Src: 192.168.80.129, Dst: 192.168.80.128
Transmission Control Protocol, Src Port: 45497, Dst Port: 1025, Seq: 0, Len: 0
    Source Port: 45497
    Destination Port: 1025
    [Stream index: 2]
    [TCP Segment Len: 0]
    Sequence number: 0    (relative sequence number)
    [Next sequence number: 0    (relative sequence number)]
    Acknowledgment number: 0
    0110 .... = Header Length: 24 bytes (6)
    Flags: 0x002 (SYN)
    Window size value: 1024
    [Calculated window size: 1024]
    Checksum: 0x5f16 [unverified]
    [Checksum Status: Unverified]
    Urgent pointer: 0
    Options: (4 bytes), Maximum segment size
    [Timestamps]

No.     Time           Source                Destination           Protocol Length Info
     10 0.097053669    192.168.80.128        192.168.80.129        TCP      54     1025 → 45497 [RST, ACK] Seq=1 Ack=1 Win=0 Len=0

Frame 10: 54 bytes on wire (432 bits), 54 bytes captured (432 bits) on interface 0
Ethernet II, Src: Vmware_fa:01:8a (00:0c:29:fa:01:8a), Dst: Vmware_97:46:06 (00:0c:29:97:46:06)
Internet Protocol Version 4, Src: 192.168.80.128, Dst: 192.168.80.129
Transmission Control Protocol, Src Port: 1025, Dst Port: 45497, Seq: 1, Ack: 1, Len: 0
    Source Port: 1025
    Destination Port: 45497
    [Stream index: 2]
    [TCP Segment Len: 0]
    Sequence number: 1    (relative sequence number)
    [Next sequence number: 1    (relative sequence number)]
    Acknowledgment number: 1    (relative ack number)
    0101 .... = Header Length: 20 bytes (5)
    Flags: 0x014 (RST, ACK)
    Window size value: 0
    [Calculated window size: 0]
    [Window size scaling factor: -2 (no window scaling used)]
    Checksum: 0x7abf [unverified]
    [Checksum Status: Unverified]
    Urgent pointer: 0
    [SEQ/ACK analysis]
    [Timestamps]

No.     Time           Source                Destination           Protocol Length Info
     11 0.097099496    192.168.80.129        192.168.80.128        TCP      60     45497 → 3306 [SYN] Seq=0 Win=1024 Len=0 MSS=1460

Frame 11: 60 bytes on wire (480 bits), 60 bytes captured (480 bits) on interface 0
Ethernet II, Src: Vmware_97:46:06 (00:0c:29:97:46:06), Dst: Vmware_fa:01:8a (00:0c:29:fa:01:8a)
Internet Protocol Version 4, Src: 192.168.80.129, Dst: 192.168.80.128
Transmission Control Protocol, Src Port: 45497, Dst Port: 3306, Seq: 0, Len: 0
    Source Port: 45497
    Destination Port: 3306
    [Stream index: 3]
    [TCP Segment Len: 0]
    Sequence number: 0    (relative sequence number)
    [Next sequence number: 0    (relative sequence number)]
    Acknowledgment number: 0
    0110 .... = Header Length: 24 bytes (6)
    Flags: 0x002 (SYN)
    Window size value: 1024
    [Calculated window size: 1024]
    Checksum: 0x562d [unverified]
    [Checksum Status: Unverified]
    Urgent pointer: 0
    Options: (4 bytes), Maximum segment size
    [Timestamps]

No.     Time           Source                Destination           Protocol Length Info
     12 0.097107469    192.168.80.128        192.168.80.129        TCP      54     3306 → 45497 [RST, ACK] Seq=1 Ack=1 Win=0 Len=0

Frame 12: 54 bytes on wire (432 bits), 54 bytes captured (432 bits) on interface 0
Ethernet II, Src: Vmware_fa:01:8a (00:0c:29:fa:01:8a), Dst: Vmware_97:46:06 (00:0c:29:97:46:06)
Internet Protocol Version 4, Src: 192.168.80.128, Dst: 192.168.80.129
Transmission Control Protocol, Src Port: 3306, Dst Port: 45497, Seq: 1, Ack: 1, Len: 0
    Source Port: 3306
    Destination Port: 45497
    [Stream index: 3]
    [TCP Segment Len: 0]
    Sequence number: 1    (relative sequence number)
    [Next sequence number: 1    (relative sequence number)]
    Acknowledgment number: 1    (relative ack number)
    0101 .... = Header Length: 20 bytes (5)
    Flags: 0x014 (RST, ACK)
    Window size value: 0
    [Calculated window size: 0]
    [Window size scaling factor: -2 (no window scaling used)]
    Checksum: 0x71d6 [unverified]
    [Checksum Status: Unverified]
    Urgent pointer: 0
    [SEQ/ACK analysis]
    [Timestamps]

No.     Time           Source                Destination           Protocol Length Info
     13 0.097381435    192.168.80.129        192.168.80.128        TCP      60     45497 → 21 [SYN] Seq=0 Win=1024 Len=0 MSS=1460

Frame 13: 60 bytes on wire (480 bits), 60 bytes captured (480 bits) on interface 0
Ethernet II, Src: Vmware_97:46:06 (00:0c:29:97:46:06), Dst: Vmware_fa:01:8a (00:0c:29:fa:01:8a)
Internet Protocol Version 4, Src: 192.168.80.129, Dst: 192.168.80.128
Transmission Control Protocol, Src Port: 45497, Dst Port: 21, Seq: 0, Len: 0
    Source Port: 45497
    Destination Port: 21
    [Stream index: 4]
    [TCP Segment Len: 0]
    Sequence number: 0    (relative sequence number)
    [Next sequence number: 0    (relative sequence number)]
    Acknowledgment number: 0
    0110 .... = Header Length: 24 bytes (6)
    Flags: 0x002 (SYN)
    Window size value: 1024
    [Calculated window size: 1024]
    Checksum: 0x6302 [unverified]
    [Checksum Status: Unverified]
    Urgent pointer: 0
    Options: (4 bytes), Maximum segment size
    [Timestamps]

No.     Time           Source                Destination           Protocol Length Info
     14 0.097437097    192.168.80.128        192.168.80.129        TCP      54     21 → 45497 [RST, ACK] Seq=1 Ack=1 Win=0 Len=0

Frame 14: 54 bytes on wire (432 bits), 54 bytes captured (432 bits) on interface 0
Ethernet II, Src: Vmware_fa:01:8a (00:0c:29:fa:01:8a), Dst: Vmware_97:46:06 (00:0c:29:97:46:06)
Internet Protocol Version 4, Src: 192.168.80.128, Dst: 192.168.80.129
Transmission Control Protocol, Src Port: 21, Dst Port: 45497, Seq: 1, Ack: 1, Len: 0
    Source Port: 21
    Destination Port: 45497
    [Stream index: 4]
    [TCP Segment Len: 0]
    Sequence number: 1    (relative sequence number)
    [Next sequence number: 1    (relative sequence number)]
    Acknowledgment number: 1    (relative ack number)
    0101 .... = Header Length: 20 bytes (5)
    Flags: 0x014 (RST, ACK)
    Window size value: 0
    [Calculated window size: 0]
    [Window size scaling factor: -2 (no window scaling used)]
    Checksum: 0x7eab [unverified]
    [Checksum Status: Unverified]
    Urgent pointer: 0
    [SEQ/ACK analysis]
    [Timestamps]

No.     Time           Source                Destination           Protocol Length Info
     15 0.097491951    192.168.80.129        192.168.80.128        TCP      60     45497 → 8888 [SYN] Seq=0 Win=1024 Len=0 MSS=1460

Frame 15: 60 bytes on wire (480 bits), 60 bytes captured (480 bits) on interface 0
Ethernet II, Src: Vmware_97:46:06 (00:0c:29:97:46:06), Dst: Vmware_fa:01:8a (00:0c:29:fa:01:8a)
Internet Protocol Version 4, Src: 192.168.80.129, Dst: 192.168.80.128
Transmission Control Protocol, Src Port: 45497, Dst Port: 8888, Seq: 0, Len: 0
    Source Port: 45497
    Destination Port: 8888
    [Stream index: 5]
    [TCP Segment Len: 0]
    Sequence number: 0    (relative sequence number)
    [Next sequence number: 0    (relative sequence number)]
    Acknowledgment number: 0
    0110 .... = Header Length: 24 bytes (6)
    Flags: 0x002 (SYN)
    Window size value: 1024
    [Calculated window size: 1024]
    Checksum: 0x405f [unverified]
    [Checksum Status: Unverified]
    Urgent pointer: 0
    Options: (4 bytes), Maximum segment size
    [Timestamps]

No.     Time           Source                Destination           Protocol Length Info
     16 0.097501136    192.168.80.128        192.168.80.129        TCP      54     8888 → 45497 [RST, ACK] Seq=1 Ack=1 Win=0 Len=0

Frame 16: 54 bytes on wire (432 bits), 54 bytes captured (432 bits) on interface 0
Ethernet II, Src: Vmware_fa:01:8a (00:0c:29:fa:01:8a), Dst: Vmware_97:46:06 (00:0c:29:97:46:06)
Internet Protocol Version 4, Src: 192.168.80.128, Dst: 192.168.80.129
Transmission Control Protocol, Src Port: 8888, Dst Port: 45497, Seq: 1, Ack: 1, Len: 0
    Source Port: 8888
    Destination Port: 45497
    [Stream index: 5]
    [TCP Segment Len: 0]
    Sequence number: 1    (relative sequence number)
    [Next sequence number: 1    (relative sequence number)]
    Acknowledgment number: 1    (relative ack number)
    0101 .... = Header Length: 20 bytes (5)
    Flags: 0x014 (RST, ACK)
    Window size value: 0
    [Calculated window size: 0]
    [Window size scaling factor: -2 (no window scaling used)]
    Checksum: 0x5c08 [unverified]
    [Checksum Status: Unverified]
    Urgent pointer: 0
    [SEQ/ACK analysis]
    [Timestamps]

No.     Time           Source                Destination           Protocol Length Info
     17 0.097549599    192.168.80.129        192.168.80.128        TCP      60     45497 → 5900 [SYN] Seq=0 Win=1024 Len=0 MSS=1460

Frame 17: 60 bytes on wire (480 bits), 60 bytes captured (480 bits) on interface 0
Ethernet II, Src: Vmware_97:46:06 (00:0c:29:97:46:06), Dst: Vmware_fa:01:8a (00:0c:29:fa:01:8a)
Internet Protocol Version 4, Src: 192.168.80.129, Dst: 192.168.80.128
Transmission Control Protocol, Src Port: 45497, Dst Port: 5900, Seq: 0, Len: 0
    Source Port: 45497
    Destination Port: 5900
    [Stream index: 6]
    [TCP Segment Len: 0]
    Sequence number: 0    (relative sequence number)
    [Next sequence number: 0    (relative sequence number)]
    Acknowledgment number: 0
    0110 .... = Header Length: 24 bytes (6)
    Flags: 0x002 (SYN)
    Window size value: 1024
    [Calculated window size: 1024]
    Checksum: 0x4c0b [unverified]
    [Checksum Status: Unverified]
    Urgent pointer: 0
    Options: (4 bytes), Maximum segment size
    [Timestamps]

No.     Time           Source                Destination           Protocol Length Info
     18 0.097558506    192.168.80.128        192.168.80.129        TCP      54     5900 → 45497 [RST, ACK] Seq=1 Ack=1 Win=0 Len=0

Frame 18: 54 bytes on wire (432 bits), 54 bytes captured (432 bits) on interface 0
Ethernet II, Src: Vmware_fa:01:8a (00:0c:29:fa:01:8a), Dst: Vmware_97:46:06 (00:0c:29:97:46:06)
Internet Protocol Version 4, Src: 192.168.80.128, Dst: 192.168.80.129
Transmission Control Protocol, Src Port: 5900, Dst Port: 45497, Seq: 1, Ack: 1, Len: 0
    Source Port: 5900
    Destination Port: 45497
    [Stream index: 6]
    [TCP Segment Len: 0]
    Sequence number: 1    (relative sequence number)
    [Next sequence number: 1    (relative sequence number)]
    Acknowledgment number: 1    (relative ack number)
    0101 .... = Header Length: 20 bytes (5)
    Flags: 0x014 (RST, ACK)
    Window size value: 0
    [Calculated window size: 0]
    [Window size scaling factor: -2 (no window scaling used)]
    Checksum: 0x67b4 [unverified]
    [Checksum Status: Unverified]
    Urgent pointer: 0
    [SEQ/ACK analysis]
    [Timestamps]

No.     Time           Source                Destination           Protocol Length Info
     19 0.097755340    192.168.80.129        192.168.80.128        TCP      60     45497 → 1720 [SYN] Seq=0 Win=1024 Len=0 MSS=1460

Frame 19: 60 bytes on wire (480 bits), 60 bytes captured (480 bits) on interface 0
Ethernet II, Src: Vmware_97:46:06 (00:0c:29:97:46:06), Dst: Vmware_fa:01:8a (00:0c:29:fa:01:8a)
Internet Protocol Version 4, Src: 192.168.80.129, Dst: 192.168.80.128
Transmission Control Protocol, Src Port: 45497, Dst Port: 1720, Seq: 0, Len: 0
    Source Port: 45497
    Destination Port: 1720
    [Stream index: 7]
    [TCP Segment Len: 0]
    Sequence number: 0    (relative sequence number)
    [Next sequence number: 0    (relative sequence number)]
    Acknowledgment number: 0
    0110 .... = Header Length: 24 bytes (6)
    Flags: 0x002 (SYN)
    Window size value: 1024
    [Calculated window size: 1024]
    Checksum: 0x5c5f [unverified]
    [Checksum Status: Unverified]
    Urgent pointer: 0
    Options: (4 bytes), Maximum segment size
    [Timestamps]

No.     Time           Source                Destination           Protocol Length Info
     20 0.097767646    192.168.80.128        192.168.80.129        TCP      54     1720 → 45497 [RST, ACK] Seq=1 Ack=1 Win=0 Len=0

Frame 20: 54 bytes on wire (432 bits), 54 bytes captured (432 bits) on interface 0
Ethernet II, Src: Vmware_fa:01:8a (00:0c:29:fa:01:8a), Dst: Vmware_97:46:06 (00:0c:29:97:46:06)
Internet Protocol Version 4, Src: 192.168.80.128, Dst: 192.168.80.129
Transmission Control Protocol, Src Port: 1720, Dst Port: 45497, Seq: 1, Ack: 1, Len: 0
    Source Port: 1720
    Destination Port: 45497
    [Stream index: 7]
    [TCP Segment Len: 0]
    Sequence number: 1    (relative sequence number)
    [Next sequence number: 1    (relative sequence number)]
    Acknowledgment number: 1    (relative ack number)
    0101 .... = Header Length: 20 bytes (5)
    Flags: 0x014 (RST, ACK)
    Window size value: 0
    [Calculated window size: 0]
    [Window size scaling factor: -2 (no window scaling used)]
    Checksum: 0x7808 [unverified]
    [Checksum Status: Unverified]
    Urgent pointer: 0
    [SEQ/ACK analysis]
    [Timestamps]

No.     Time           Source                Destination           Protocol Length Info
     21 0.097943009    192.168.80.129        192.168.80.128        TCP      60     45497 → 143 [SYN] Seq=0 Win=1024 Len=0 MSS=1460

Frame 21: 60 bytes on wire (480 bits), 60 bytes captured (480 bits) on interface 0
Ethernet II, Src: Vmware_97:46:06 (00:0c:29:97:46:06), Dst: Vmware_fa:01:8a (00:0c:29:fa:01:8a)
Internet Protocol Version 4, Src: 192.168.80.129, Dst: 192.168.80.128
Transmission Control Protocol, Src Port: 45497, Dst Port: 143, Seq: 0, Len: 0
    Source Port: 45497
    Destination Port: 143
    [Stream index: 8]
    [TCP Segment Len: 0]
    Sequence number: 0    (relative sequence number)
    [Next sequence number: 0    (relative sequence number)]
    Acknowledgment number: 0
    0110 .... = Header Length: 24 bytes (6)
    Flags: 0x002 (SYN)
    Window size value: 1024
    [Calculated window size: 1024]
    Checksum: 0x6288 [unverified]
    [Checksum Status: Unverified]
    Urgent pointer: 0
    Options: (4 bytes), Maximum segment size
    [Timestamps]

No.     Time           Source                Destination           Protocol Length Info
     22 0.097955733    192.168.80.128        192.168.80.129        TCP      54     143 → 45497 [RST, ACK] Seq=1 Ack=1 Win=0 Len=0

Frame 22: 54 bytes on wire (432 bits), 54 bytes captured (432 bits) on interface 0
Ethernet II, Src: Vmware_fa:01:8a (00:0c:29:fa:01:8a), Dst: Vmware_97:46:06 (00:0c:29:97:46:06)
Internet Protocol Version 4, Src: 192.168.80.128, Dst: 192.168.80.129
Transmission Control Protocol, Src Port: 143, Dst Port: 45497, Seq: 1, Ack: 1, Len: 0
    Source Port: 143
    Destination Port: 45497
    [Stream index: 8]
    [TCP Segment Len: 0]
    Sequence number: 1    (relative sequence number)
    [Next sequence number: 1    (relative sequence number)]
    Acknowledgment number: 1    (relative ack number)
    0101 .... = Header Length: 20 bytes (5)
    Flags: 0x014 (RST, ACK)
    Window size value: 0
    [Calculated window size: 0]
    [Window size scaling factor: -2 (no window scaling used)]
    Checksum: 0x7e31 [unverified]
    [Checksum Status: Unverified]
    Urgent pointer: 0
    [SEQ/ACK analysis]
    [Timestamps]

No.     Time           Source                Destination           Protocol Length Info
     23 0.098119998    192.168.80.129        192.168.80.128        TCP      60     45497 → 80 [SYN] Seq=0 Win=1024 Len=0 MSS=1460

Frame 23: 60 bytes on wire (480 bits), 60 bytes captured (480 bits) on interface 0
Ethernet II, Src: Vmware_97:46:06 (00:0c:29:97:46:06), Dst: Vmware_fa:01:8a (00:0c:29:fa:01:8a)
Internet Protocol Version 4, Src: 192.168.80.129, Dst: 192.168.80.128
Transmission Control Protocol, Src Port: 45497, Dst Port: 80, Seq: 0, Len: 0
    Source Port: 45497
    Destination Port: 80
    [Stream index: 9]
    [TCP Segment Len: 0]
    Sequence number: 0    (relative sequence number)
    [Next sequence number: 0    (relative sequence number)]
    Acknowledgment number: 0
    0110 .... = Header Length: 24 bytes (6)
    Flags: 0x002 (SYN)
    Window size value: 1024
    [Calculated window size: 1024]
    Checksum: 0x62c7 [unverified]
    [Checksum Status: Unverified]
    Urgent pointer: 0
    Options: (4 bytes), Maximum segment size
    [Timestamps]

No.     Time           Source                Destination           Protocol Length Info
     24 0.098135410    192.168.80.128        192.168.80.129        TCP      54     80 → 45497 [RST, ACK] Seq=1 Ack=1 Win=0 Len=0

Frame 24: 54 bytes on wire (432 bits), 54 bytes captured (432 bits) on interface 0
Ethernet II, Src: Vmware_fa:01:8a (00:0c:29:fa:01:8a), Dst: Vmware_97:46:06 (00:0c:29:97:46:06)
Internet Protocol Version 4, Src: 192.168.80.128, Dst: 192.168.80.129
Transmission Control Protocol, Src Port: 80, Dst Port: 45497, Seq: 1, Ack: 1, Len: 0
    Source Port: 80
    Destination Port: 45497
    [Stream index: 9]
    [TCP Segment Len: 0]
    Sequence number: 1    (relative sequence number)
    [Next sequence number: 1    (relative sequence number)]
    Acknowledgment number: 1    (relative ack number)
    0101 .... = Header Length: 20 bytes (5)
    Flags: 0x014 (RST, ACK)
    Window size value: 0
    [Calculated window size: 0]
    [Window size scaling factor: -2 (no window scaling used)]
    Checksum: 0x7e70 [unverified]
    [Checksum Status: Unverified]
    Urgent pointer: 0
    [SEQ/ACK analysis]
    [Timestamps]

No.     Time           Source                Destination           Protocol Length Info
     25 0.098752070    192.168.80.129        192.168.80.128        TCP      60     45497 → 139 [SYN] Seq=0 Win=1024 Len=0 MSS=1460

Frame 25: 60 bytes on wire (480 bits), 60 bytes captured (480 bits) on interface 0
Ethernet II, Src: Vmware_97:46:06 (00:0c:29:97:46:06), Dst: Vmware_fa:01:8a (00:0c:29:fa:01:8a)
Internet Protocol Version 4, Src: 192.168.80.129, Dst: 192.168.80.128
Transmission Control Protocol, Src Port: 45497, Dst Port: 139, Seq: 0, Len: 0
    Source Port: 45497
    Destination Port: 139
    [Stream index: 10]
    [TCP Segment Len: 0]
    Sequence number: 0    (relative sequence number)
    [Next sequence number: 0    (relative sequence number)]
    Acknowledgment number: 0
    0110 .... = Header Length: 24 bytes (6)
    Flags: 0x002 (SYN)
    Window size value: 1024
    [Calculated window size: 1024]
    Checksum: 0x628c [unverified]
    [Checksum Status: Unverified]
    Urgent pointer: 0
    Options: (4 bytes), Maximum segment size
    [Timestamps]

No.     Time           Source                Destination           Protocol Length Info
     26 0.098770746    192.168.80.128        192.168.80.129        TCP      54     139 → 45497 [RST, ACK] Seq=1 Ack=1 Win=0 Len=0

Frame 26: 54 bytes on wire (432 bits), 54 bytes captured (432 bits) on interface 0
Ethernet II, Src: Vmware_fa:01:8a (00:0c:29:fa:01:8a), Dst: Vmware_97:46:06 (00:0c:29:97:46:06)
Internet Protocol Version 4, Src: 192.168.80.128, Dst: 192.168.80.129
Transmission Control Protocol, Src Port: 139, Dst Port: 45497, Seq: 1, Ack: 1, Len: 0
    Source Port: 139
    Destination Port: 45497
    [Stream index: 10]
    [TCP Segment Len: 0]
    Sequence number: 1    (relative sequence number)
    [Next sequence number: 1    (relative sequence number)]
    Acknowledgment number: 1    (relative ack number)
    0101 .... = Header Length: 20 bytes (5)
    Flags: 0x014 (RST, ACK)
    Window size value: 0
    [Calculated window size: 0]
    [Window size scaling factor: -2 (no window scaling used)]
    Checksum: 0x7e35 [unverified]
    [Checksum Status: Unverified]
    Urgent pointer: 0
    [SEQ/ACK analysis]
    [Timestamps]

No.     Time           Source                Destination           Protocol Length Info
     27 0.098827597    192.168.80.129        192.168.80.128        TCP      60     45497 → 111 [SYN] Seq=0 Win=1024 Len=0 MSS=1460

Frame 27: 60 bytes on wire (480 bits), 60 bytes captured (480 bits) on interface 0
Ethernet II, Src: Vmware_97:46:06 (00:0c:29:97:46:06), Dst: Vmware_fa:01:8a (00:0c:29:fa:01:8a)
Internet Protocol Version 4, Src: 192.168.80.129, Dst: 192.168.80.128
Transmission Control Protocol, Src Port: 45497, Dst Port: 111, Seq: 0, Len: 0
    Source Port: 45497
    Destination Port: 111
    [Stream index: 11]
    [TCP Segment Len: 0]
    Sequence number: 0    (relative sequence number)
    [Next sequence number: 0    (relative sequence number)]
    Acknowledgment number: 0
    0110 .... = Header Length: 24 bytes (6)
    Flags: 0x002 (SYN)
    Window size value: 1024
    [Calculated window size: 1024]
    Checksum: 0x62a8 [unverified]
    [Checksum Status: Unverified]
    Urgent pointer: 0
    Options: (4 bytes), Maximum segment size
    [Timestamps]

No.     Time           Source                Destination           Protocol Length Info
     28 0.098837685    192.168.80.128        192.168.80.129        TCP      54     111 → 45497 [RST, ACK] Seq=1 Ack=1 Win=0 Len=0

Frame 28: 54 bytes on wire (432 bits), 54 bytes captured (432 bits) on interface 0
Ethernet II, Src: Vmware_fa:01:8a (00:0c:29:fa:01:8a), Dst: Vmware_97:46:06 (00:0c:29:97:46:06)
Internet Protocol Version 4, Src: 192.168.80.128, Dst: 192.168.80.129
Transmission Control Protocol, Src Port: 111, Dst Port: 45497, Seq: 1, Ack: 1, Len: 0
    Source Port: 111
    Destination Port: 45497
    [Stream index: 11]
    [TCP Segment Len: 0]
    Sequence number: 1    (relative sequence number)
    [Next sequence number: 1    (relative sequence number)]
    Acknowledgment number: 1    (relative ack number)
    0101 .... = Header Length: 20 bytes (5)
    Flags: 0x014 (RST, ACK)
    Window size value: 0
    [Calculated window size: 0]
    [Window size scaling factor: -2 (no window scaling used)]
    Checksum: 0x7e51 [unverified]
    [Checksum Status: Unverified]
    Urgent pointer: 0
    [SEQ/ACK analysis]
    [Timestamps]

No.     Time           Source                Destination           Protocol Length Info
     29 0.098888220    192.168.80.129        192.168.80.128        TCP      60     45497 → 53 [SYN] Seq=0 Win=1024 Len=0 MSS=1460

Frame 29: 60 bytes on wire (480 bits), 60 bytes captured (480 bits) on interface 0
Ethernet II, Src: Vmware_97:46:06 (00:0c:29:97:46:06), Dst: Vmware_fa:01:8a (00:0c:29:fa:01:8a)
Internet Protocol Version 4, Src: 192.168.80.129, Dst: 192.168.80.128
Transmission Control Protocol, Src Port: 45497, Dst Port: 53, Seq: 0, Len: 0
    Source Port: 45497
    Destination Port: 53
    [Stream index: 12]
    [TCP Segment Len: 0]
    Sequence number: 0    (relative sequence number)
    [Next sequence number: 0    (relative sequence number)]
    Acknowledgment number: 0
    0110 .... = Header Length: 24 bytes (6)
    Flags: 0x002 (SYN)
    Window size value: 1024
    [Calculated window size: 1024]
    Checksum: 0x62e2 [unverified]
    [Checksum Status: Unverified]
    Urgent pointer: 0
    Options: (4 bytes), Maximum segment size
    [Timestamps]

No.     Time           Source                Destination           Protocol Length Info
     30 0.098896803    192.168.80.128        192.168.80.129        TCP      54     53 → 45497 [RST, ACK] Seq=1 Ack=1 Win=0 Len=0

Frame 30: 54 bytes on wire (432 bits), 54 bytes captured (432 bits) on interface 0
Ethernet II, Src: Vmware_fa:01:8a (00:0c:29:fa:01:8a), Dst: Vmware_97:46:06 (00:0c:29:97:46:06)
Internet Protocol Version 4, Src: 192.168.80.128, Dst: 192.168.80.129
Transmission Control Protocol, Src Port: 53, Dst Port: 45497, Seq: 1, Ack: 1, Len: 0
    Source Port: 53
    Destination Port: 45497
    [Stream index: 12]
    [TCP Segment Len: 0]
    Sequence number: 1    (relative sequence number)
    [Next sequence number: 1    (relative sequence number)]
    Acknowledgment number: 1    (relative ack number)
    0101 .... = Header Length: 20 bytes (5)
    Flags: 0x014 (RST, ACK)
    Window size value: 0
    [Calculated window size: 0]
    [Window size scaling factor: -2 (no window scaling used)]
    Checksum: 0x7e8b [unverified]
    [Checksum Status: Unverified]
    Urgent pointer: 0
    [SEQ/ACK analysis]
    [Timestamps]

No.     Time           Source                Destination           Protocol Length Info
     31 0.099072303    192.168.80.129        192.168.80.128        TCP      60     45497 → 25 [SYN] Seq=0 Win=1024 Len=0 MSS=1460

Frame 31: 60 bytes on wire (480 bits), 60 bytes captured (480 bits) on interface 0
Ethernet II, Src: Vmware_97:46:06 (00:0c:29:97:46:06), Dst: Vmware_fa:01:8a (00:0c:29:fa:01:8a)
Internet Protocol Version 4, Src: 192.168.80.129, Dst: 192.168.80.128
Transmission Control Protocol, Src Port: 45497, Dst Port: 25, Seq: 0, Len: 0
    Source Port: 45497
    Destination Port: 25
    [Stream index: 13]
    [TCP Segment Len: 0]
    Sequence number: 0    (relative sequence number)
    [Next sequence number: 0    (relative sequence number)]
    Acknowledgment number: 0
    0110 .... = Header Length: 24 bytes (6)
    Flags: 0x002 (SYN)
    Window size value: 1024
    [Calculated window size: 1024]
    Checksum: 0x62fe [unverified]
    [Checksum Status: Unverified]
    Urgent pointer: 0
    Options: (4 bytes), Maximum segment size
    [Timestamps]

No.     Time           Source                Destination           Protocol Length Info
     32 0.099087623    192.168.80.128        192.168.80.129        TCP      54     25 → 45497 [RST, ACK] Seq=1 Ack=1 Win=0 Len=0

Frame 32: 54 bytes on wire (432 bits), 54 bytes captured (432 bits) on interface 0
Ethernet II, Src: Vmware_fa:01:8a (00:0c:29:fa:01:8a), Dst: Vmware_97:46:06 (00:0c:29:97:46:06)
Internet Protocol Version 4, Src: 192.168.80.128, Dst: 192.168.80.129
Transmission Control Protocol, Src Port: 25, Dst Port: 45497, Seq: 1, Ack: 1, Len: 0
    Source Port: 25
    Destination Port: 45497
    [Stream index: 13]
    [TCP Segment Len: 0]
    Sequence number: 1    (relative sequence number)
    [Next sequence number: 1    (relative sequence number)]
    Acknowledgment number: 1    (relative ack number)
    0101 .... = Header Length: 20 bytes (5)
    Flags: 0x014 (RST, ACK)
    Window size value: 0
    [Calculated window size: 0]
    [Window size scaling factor: -2 (no window scaling used)]
    Checksum: 0x7ea7 [unverified]
    [Checksum Status: Unverified]
    Urgent pointer: 0
    [SEQ/ACK analysis]
    [Timestamps]

No.     Time           Source                Destination           Protocol Length Info
     33 0.099222684    192.168.80.129        192.168.80.128        TCP      60     45497 → 993 [SYN] Seq=0 Win=1024 Len=0 MSS=1460

Frame 33: 60 bytes on wire (480 bits), 60 bytes captured (480 bits) on interface 0
Ethernet II, Src: Vmware_97:46:06 (00:0c:29:97:46:06), Dst: Vmware_fa:01:8a (00:0c:29:fa:01:8a)
Internet Protocol Version 4, Src: 192.168.80.129, Dst: 192.168.80.128
Transmission Control Protocol, Src Port: 45497, Dst Port: 993, Seq: 0, Len: 0
    Source Port: 45497
    Destination Port: 993
    [Stream index: 14]
    [TCP Segment Len: 0]
    Sequence number: 0    (relative sequence number)
    [Next sequence number: 0    (relative sequence number)]
    Acknowledgment number: 0
    0110 .... = Header Length: 24 bytes (6)
    Flags: 0x002 (SYN)
    Window size value: 1024
    [Calculated window size: 1024]
    Checksum: 0x5f36 [unverified]
    [Checksum Status: Unverified]
    Urgent pointer: 0
    Options: (4 bytes), Maximum segment size
    [Timestamps]

No.     Time           Source                Destination           Protocol Length Info
     34 0.099233793    192.168.80.128        192.168.80.129        TCP      54     993 → 45497 [RST, ACK] Seq=1 Ack=1 Win=0 Len=0

Frame 34: 54 bytes on wire (432 bits), 54 bytes captured (432 bits) on interface 0
Ethernet II, Src: Vmware_fa:01:8a (00:0c:29:fa:01:8a), Dst: Vmware_97:46:06 (00:0c:29:97:46:06)
Internet Protocol Version 4, Src: 192.168.80.128, Dst: 192.168.80.129
Transmission Control Protocol, Src Port: 993, Dst Port: 45497, Seq: 1, Ack: 1, Len: 0
    Source Port: 993
    Destination Port: 45497
    [Stream index: 14]
    [TCP Segment Len: 0]
    Sequence number: 1    (relative sequence number)
    [Next sequence number: 1    (relative sequence number)]
    Acknowledgment number: 1    (relative ack number)
    0101 .... = Header Length: 20 bytes (5)
    Flags: 0x014 (RST, ACK)
    Window size value: 0
    [Calculated window size: 0]
    [Window size scaling factor: -2 (no window scaling used)]
    Checksum: 0x7adf [unverified]
    [Checksum Status: Unverified]
    Urgent pointer: 0
    [SEQ/ACK analysis]
    [Timestamps]

No.     Time           Source                Destination           Protocol Length Info
     35 0.099285789    192.168.80.129        192.168.80.128        TCP      60     45497 → 23 [SYN] Seq=0 Win=1024 Len=0 MSS=1460

Frame 35: 60 bytes on wire (480 bits), 60 bytes captured (480 bits) on interface 0
Ethernet II, Src: Vmware_97:46:06 (00:0c:29:97:46:06), Dst: Vmware_fa:01:8a (00:0c:29:fa:01:8a)
Internet Protocol Version 4, Src: 192.168.80.129, Dst: 192.168.80.128
Transmission Control Protocol, Src Port: 45497, Dst Port: 23, Seq: 0, Len: 0
    Source Port: 45497
    Destination Port: 23
    [Stream index: 15]
    [TCP Segment Len: 0]
    Sequence number: 0    (relative sequence number)
    [Next sequence number: 0    (relative sequence number)]
    Acknowledgment number: 0
    0110 .... = Header Length: 24 bytes (6)
    Flags: 0x002 (SYN)
    Window size value: 1024
    [Calculated window size: 1024]
    Checksum: 0x6300 [unverified]
    [Checksum Status: Unverified]
    Urgent pointer: 0
    Options: (4 bytes), Maximum segment size
    [Timestamps]

No.     Time           Source                Destination           Protocol Length Info
     36 0.099302049    192.168.80.128        192.168.80.129        TCP      54     23 → 45497 [RST, ACK] Seq=1 Ack=1 Win=0 Len=0

Frame 36: 54 bytes on wire (432 bits), 54 bytes captured (432 bits) on interface 0
Ethernet II, Src: Vmware_fa:01:8a (00:0c:29:fa:01:8a), Dst: Vmware_97:46:06 (00:0c:29:97:46:06)
Internet Protocol Version 4, Src: 192.168.80.128, Dst: 192.168.80.129
Transmission Control Protocol, Src Port: 23, Dst Port: 45497, Seq: 1, Ack: 1, Len: 0
    Source Port: 23
    Destination Port: 45497
    [Stream index: 15]
    [TCP Segment Len: 0]
    Sequence number: 1    (relative sequence number)
    [Next sequence number: 1    (relative sequence number)]
    Acknowledgment number: 1    (relative ack number)
    0101 .... = Header Length: 20 bytes (5)
    Flags: 0x014 (RST, ACK)
    Window size value: 0
    [Calculated window size: 0]
    [Window size scaling factor: -2 (no window scaling used)]
    Checksum: 0x7ea9 [unverified]
    [Checksum Status: Unverified]
    Urgent pointer: 0
    [SEQ/ACK analysis]
    [Timestamps]

No.     Time           Source                Destination           Protocol Length Info
     37 0.099424728    192.168.80.129        192.168.80.128        TCP      60     45497 → 3389 [SYN] Seq=0 Win=1024 Len=0 MSS=1460

Frame 37: 60 bytes on wire (480 bits), 60 bytes captured (480 bits) on interface 0
Ethernet II, Src: Vmware_97:46:06 (00:0c:29:97:46:06), Dst: Vmware_fa:01:8a (00:0c:29:fa:01:8a)
Internet Protocol Version 4, Src: 192.168.80.129, Dst: 192.168.80.128
Transmission Control Protocol, Src Port: 45497, Dst Port: 3389, Seq: 0, Len: 0
    Source Port: 45497
    Destination Port: 3389
    [Stream index: 16]
    [TCP Segment Len: 0]
    Sequence number: 0    (relative sequence number)
    [Next sequence number: 0    (relative sequence number)]
    Acknowledgment number: 0
    0110 .... = Header Length: 24 bytes (6)
    Flags: 0x002 (SYN)
    Window size value: 1024
    [Calculated window size: 1024]
    Checksum: 0x55da [unverified]
    [Checksum Status: Unverified]
    Urgent pointer: 0
    Options: (4 bytes), Maximum segment size
    [Timestamps]

No.     Time           Source                Destination           Protocol Length Info
     38 0.099434882    192.168.80.128        192.168.80.129        TCP      54     3389 → 45497 [RST, ACK] Seq=1 Ack=1 Win=0 Len=0

Frame 38: 54 bytes on wire (432 bits), 54 bytes captured (432 bits) on interface 0
Ethernet II, Src: Vmware_fa:01:8a (00:0c:29:fa:01:8a), Dst: Vmware_97:46:06 (00:0c:29:97:46:06)
Internet Protocol Version 4, Src: 192.168.80.128, Dst: 192.168.80.129
Transmission Control Protocol, Src Port: 3389, Dst Port: 45497, Seq: 1, Ack: 1, Len: 0
    Source Port: 3389
    Destination Port: 45497
    [Stream index: 16]
    [TCP Segment Len: 0]
    Sequence number: 1    (relative sequence number)
    [Next sequence number: 1    (relative sequence number)]
    Acknowledgment number: 1    (relative ack number)
    0101 .... = Header Length: 20 bytes (5)
    Flags: 0x014 (RST, ACK)
    Window size value: 0
    [Calculated window size: 0]
    [Window size scaling factor: -2 (no window scaling used)]
    Checksum: 0x7183 [unverified]
    [Checksum Status: Unverified]
    Urgent pointer: 0
    [SEQ/ACK analysis]
    [Timestamps]

No.     Time           Source                Destination           Protocol Length Info
     39 0.099575836    192.168.80.129        192.168.80.128        TCP      60     45497 → 199 [SYN] Seq=0 Win=1024 Len=0 MSS=1460

Frame 39: 60 bytes on wire (480 bits), 60 bytes captured (480 bits) on interface 0
Ethernet II, Src: Vmware_97:46:06 (00:0c:29:97:46:06), Dst: Vmware_fa:01:8a (00:0c:29:fa:01:8a)
